field,in_situ_relevance,machine_annotation_inat_relevance,machine_annotation_herbarium_relevance,human_observation_herbarium_relevance,alias,definedBy,datatype,source,definition
human_observation_annotation_id,REQUIRED,NOT APPLICABLE,NOT APPLICABLE,REQUIRED,,https://biscicol.org/api/v1/inaan/ark:/92250/guid?info,text,user,A globally unique identifier for an instance of a planned process (http://purl.obolibrary.org/obo/COB_0000082) that assigns a phenological trait annotation to a target plant observation based on human observation of a plant or part of the plant.
basis_of_record,REQUIRED,REQUIRED,REQUIRED,REQUIRED,,http://rs.tdwg.org/dwc/terms/basisOfRecord,keyword,user,basis of record of oberserved organism.  See darwin core reference for values
datasource,REQUIRED,REQUIRED,REQUIRED,REQUIRED,,http://rs.tdwg.org/dwc/terms/datasetName,keyword,user,name of the datasource
day_of_year,REQUIRED,REQUIRED,REQUIRED,REQUIRED,,https://biscicol.org/api/v1/inaan/ark:/92250/day_of_year?info,integer,user,day of the year.  Must be between 1 and 366
latitude,REQUIRED,REQUIRED,REQUIRED,REQUIRED,deimalLatitude,http://rs.tdwg.org/dwc/terms/decimalLatitude,float,user,latitude with precision up to 6 decimal places
longitude,REQUIRED,REQUIRED,REQUIRED,REQUIRED,decimalLongitude,"	http://rs.tdwg.org/dwc/terms/decimalLongitude",float,user,longitude with precision up to 6 decimal places
scientific_name,REQUIRED,REQUIRED,REQUIRED,REQUIRED,,http://rs.tdwg.org/dwc/terms/scientificName,text,user,scientific name of the observed organism
trait,REQUIRED,REQUIRED,REQUIRED,REQUIRED,,https://biscicol.org/api/v1/inaan/ark:/92250/trait?info,text,user,"Trait tested.  Use trait values in traits.csv file corresponding to trait terms in the Plant Phenology Ontology.  E.g.  ""flower present"", ""fruit present"", ""flower absent"", or ""fruit absent"""
year,REQUIRED,REQUIRED,REQUIRED,REQUIRED,,http://rs.tdwg.org/dwc/terms/year,integer,user,year of the observation
associatedMedia,APPLICABLE,APPLICABLE,APPLICABLE,APPLICABLE,,http://rs.tdwg.org/dwc/terms/associatedMedia,keyword,user,"A list (concatenated and separated) of identifiers (publication, global unique identifier, URI) of media associated with the dwc:Occurrence."
coordinate_uncertainty_meters,APPLICABLE,APPLICABLE,APPLICABLE,APPLICABLE,positional_accuracy,http://rs.tdwg.org/dwc/terms/coordinateUncertaintyInMeters,integer,user,coordinate uncertainty in meters
family,APPLICABLE,REQUIRED,REQUIRED,APPLICABLE,,http://rs.tdwg.org/dwc/terms/family,keyword,user,The full scientific name of the family in which the organism is classified.
genus,APPLICABLE,APPLICABLE,APPLICABLE,APPLICABLE,,http://rs.tdwg.org/dwc/terms/genus,keyword,user,The full scientific name of the genus in which the organism is classified.
individual_id,APPLICABLE,APPLICABLE,APPLICABLE,APPLICABLE,individualID,https://biscicol.org/api/v1/inaan/ark:/92250/individual_id?info,text,user,individual ID of the observed organism
locationID,APPLICABLE,APPLICABLE,APPLICABLE,APPLICABLE,,http://rs.tdwg.org/dwc/terms/locationID,text,user,An identifier for the set of dcterms:Location information. May be a global unique identifier or an identifier specific to the data set.
observed_metadata_url,APPLICABLE,APPLICABLE,APPLICABLE,APPLICABLE,inat_URL,https://biscicol.org/api/v1/inaan/ark:/92250/observed_metadata_url?info,text,user,URL for the observation metadata hosted by the datasource.  For example https://www.inaturalist.org/observations/{observation_uuid}. This will resolve to a record.
occurrence_id,APPLICABLE,APPLICABLE,APPLICABLE,APPLICABLE,occurrenceID,"	http://rs.tdwg.org/dwc/terms/occurrenceID",text,user,occurrence ID of the observed organism
recodedBy,APPLICABLE,APPLICABLE,APPLICABLE,APPLICABLE,,http://rs.tdwg.org/dwc/terms/recordedBy,keyword,user,"A list (concatenated and separated) of names of people, groups, or organizations responsible for recording the original dwc:Occurrence. The primary collector or observer, especially one who applies a personal identifier (dwc:recordNumber), should be listed first."
taxon_rank,APPLICABLE,APPLICABLE,APPLICABLE,APPLICABLE,rank,http://rs.tdwg.org/dwc/terms/taxonRank,text,user,taxonomic rank of the scientific name
verbatim_date,APPLICABLE,APPLICABLE,APPLICABLE,APPLICABLE,,https://biscicol.org/api/v1/inaan/ark:/92250/verbatim_date?info,text,user,verbatim observation date
verbatim_trait,APPLICABLE,APPLICABLE,APPLICABLE,APPLICABLE,,https://biscicol.org/api/v1/inaan/ark:/92250/verbatim_trait?info,text,user,Verbatim description of the trait
accuracy_excluding_certainty_family,NOT APPLICABLE,REQUIRED,REQUIRED,NOT APPLICABLE,,https://biscicol.org/api/v1/inaan/ark:/92250/accuracy_excluding_certainty_family?info,text,user,"A metric of accuracy for the annotations of only high certainty records based on expert, gold standard observations."
accuracy_family,NOT APPLICABLE,REQUIRED,REQUIRED,NOT APPLICABLE,,https://biscicol.org/api/v1/inaan/ark:/92250/accuracy_familyl?info,text,user,"A metric of accuracy for the annotations of all records (equivocal and unequivocal) based on expert, gold standard observations."
certainty,NOT APPLICABLE,REQUIRED,REQUIRED,NOT APPLICABLE,equivocal,https://biscicol.org/api/v1/inaan/ark:/92250/certainty?info,keyword,user,Certainy of machine observation (Low or High).  This corresponds to Equivocal (Low) and Uniquevicol (High)   
count_family,NOT APPLICABLE,APPLICABLE,APPLICABLE,NOT APPLICABLE,,https://biscicol.org/api/v1/inaan/ark:/92250/count_family?info,integer,user,The number of records that were annotated at the taxon rank of family associated with the identified occurrence
error_message,NOT APPLICABLE,APPLICABLE,APPLICABLE,NOT APPLICABLE,,https://biscicol.org/api/v1/inaan/ark:/92250/error_message?info,text,user,Error messages from processing
machine_learning_annotation_id,NOT APPLICABLE,REQUIRED,REQUIRED,NOT APPLICABLE,guid,https://biscicol.org/api/v1/inaan/ark:/92250/guid?info,text,user,A globally unique identifier for an instance of a planned process (http://purl.obolibrary.org/obo/COB_0000082) that assigns a phenological trait annotation to a target plant observation based on machine learning on an image that contains an image of the plant or part of the plant.
mapped_traits,NOT APPLICABLE,NOT APPLICABLE,NOT APPLICABLE,NOT APPLICABLE,,https://biscicol.org/api/v1/inaan/ark:/92250/mapped_traits?info,keyword,system,System inferred list of mapped traits with each trait separated by a pipe delimiter
model_uri,NOT APPLICABLE,REQUIRED,REQUIRED,NOT APPLICABLE,,https://biscicol.org/api/v1/inaan/ark:/92250/model_uri?info,text,user,URI landing page describing the model that was used.
observed_image_guid,NOT APPLICABLE,REQUIRED,REQUIRED,REQUIRED,photo_id,https://biscicol.org/api/v1/inaan/ark:/92250/observed_image_guid?info,text,user,Globally Unique Identifier of the image
observed_image_url,NOT APPLICABLE,REQUIRED,REQUIRED,APPLICABLE,,https://biscicol.org/api/v1/inaan/ark:/92250/observed_image_url?info,text,user,URL for the image
prediction_class,NOT APPLICABLE,REQUIRED,REQUIRED,NOT APPLICABLE,prediction_class,https://biscicol.org/api/v1/inaan/ark:/92250/prediction_class?info,keyword,user,"a categorical description of the annotation outcome, in this case either ""Detected"" or ""Not detected"""
predition_probability,NOT APPLICABLE,REQUIRED,REQUIRED,NOT APPLICABLE,prediction_prob,https://biscicol.org/api/v1/inaan/ark:/92250/prediction_probability?info,float,user,"""A score from 0-1 which represent a scaled probability of presence or absence of a trait"""
proportion_certainty_family,NOT APPLICABLE,REQUIRED,REQUIRED,NOT APPLICABLE,,https://biscicol.org/api/v1/inaan/ark:/92250/proportion_certainty_family?info,text,user,The proportion of the number of low certainty annotations divided by all annotations for iNaturalist observations in the taxonomic family. A metric of how successful the annotation process for observations in that family.